{
  "schemaVersion": 1,
  "productId": "siroino-tuxedo-halter-dress-large",
  "sourceReference": "private-reference://sha256/66cd898014d3f503da8015207a0240d946aac72b596f28bef8d6574a0afb678b",
  "claims": [
    {
      "field": "manufacturer",
      "status": "UNVERIFIED",
      "value": null,
      "reason": "No manufacturer name or primary-source product record is visible in the supplied reference.",
      "evidenceIds": []
    },
    {
      "field": "brand",
      "status": "UNVERIFIED",
      "value": null,
      "reason": "No brand mark, label, packaging, or exact official product page was verified.",
      "evidenceIds": []
    },
    {
      "field": "seller",
      "status": "UNVERIFIED",
      "value": null,
      "reason": "The supplied reference contains no seller identity or traceable listing provenance.",
      "evidenceIds": []
    },
    {
      "field": "officialProductName",
      "status": "UNVERIFIED",
      "value": null,
      "reason": "The internal design name is descriptive and is not asserted as an official commercial product name.",
      "evidenceIds": []
    },
    {
      "field": "modelNumber",
      "status": "UNVERIFIED",
      "value": null,
      "reason": "No manufacturer model number is visible or supported by primary evidence.",
      "evidenceIds": []
    },
    {
      "field": "sellerSku",
      "status": "UNVERIFIED",
      "value": null,
      "reason": "No seller SKU is visible or supported by a verified listing.",
      "evidenceIds": []
    },
    {
      "field": "gtin",
      "status": "UNVERIFIED",
      "value": null,
      "reason": "No GTIN barcode or brand-owner assignment evidence is available; the identifier must not be inferred.",
      "evidenceIds": []
    },
    {
      "field": "jan",
      "status": "UNVERIFIED",
      "value": null,
      "reason": "No JAN barcode or brand-owner assignment evidence is available; the identifier must not be inferred.",
      "evidenceIds": []
    },
    {
      "field": "colorCode",
      "status": "UNVERIFIED",
      "value": null,
      "reason": "The words winered and black describe visible colors but do not establish an official color code.",
      "evidenceIds": []
    },
    {
      "field": "sizeCode",
      "status": "UNVERIFIED",
      "value": null,
      "reason": "No commercial size code is visible; Siroino _Large is the target avatar profile, not a product size code.",
      "evidenceIds": []
    },
    {
      "field": "season",
      "status": "UNVERIFIED",
      "value": null,
      "reason": "No collection season or sales period is supported by primary evidence.",
      "evidenceIds": []
    },
    {
      "field": "revision",
      "status": "UNVERIFIED",
      "value": null,
      "reason": "No manufacturer or seller revision identifier is supported by primary evidence.",
      "evidenceIds": []
    }
  ],
  "evidence": [
    {
      "evidenceId": "private-reference-front",
      "evidenceType": "private-source-image-observation",
      "sourceReference": "private-reference://sha256/66cd898014d3f503da8015207a0240d946aac72b596f28bef8d6574a0afb678b",
      "capturedAt": "2026-08-05T18:00:00+09:00",
      "extractionMethod": "direct-image-inspection",
      "reviewerRole": "identity-auditor",
      "imageRegionPx": [0, 0, 854, 854],
      "note": "The image shows visible color wording and garment construction only; no brand, seller, barcode, model number, or official listing identity is visible."
    }
  ],
  "history": [
    {
      "sequence": 1,
      "field": "manufacturer",
      "status": "UNVERIFIED",
      "value": null,
      "reason": "No manufacturer name or primary-source product record is visible in the supplied reference.",
      "evidenceIds": [],
      "actorRole": "identity-auditor",
      "recordedAt": "2026-08-06T08:00:00+09:00",
      "previousDigest": "0000000000000000000000000000000000000000000000000000000000000000",
      "eventDigest": "026ce347cfcd4b5e4097055f4afa2c50a3d335ec17d054ae7cf6c86473621e72"
    },
    {
      "sequence": 2,
      "field": "brand",
      "status": "UNVERIFIED",
      "value": null,
      "reason": "No brand mark, label, packaging, or exact official product page was verified.",
      "evidenceIds": [],
      "actorRole": "identity-auditor",
      "recordedAt": "2026-08-06T08:00:00+09:00",
      "previousDigest": "026ce347cfcd4b5e4097055f4afa2c50a3d335ec17d054ae7cf6c86473621e72",
      "eventDigest": "758b42aa2c0d3a6382f9b87a425642bbbbf1730f318d9d99c77676dc547ce741"
    },
    {
      "sequence": 3,
      "field": "seller",
      "status": "UNVERIFIED",
      "value": null,
      "reason": "The supplied reference contains no seller identity or traceable listing provenance.",
      "evidenceIds": [],
      "actorRole": "identity-auditor",
      "recordedAt": "2026-08-06T08:00:00+09:00",
      "previousDigest": "758b42aa2c0d3a6382f9b87a425642bbbbf1730f318d9d99c77676dc547ce741",
      "eventDigest": "9eefae42025d4a6ed30af018a81b6f11c5b5bf09047800cea1b8754fc033f7a9"
    },
    {
      "sequence": 4,
      "field": "officialProductName",
      "status": "UNVERIFIED",
      "value": null,
      "reason": "The internal design name is descriptive and is not asserted as an official commercial product name.",
      "evidenceIds": [],
      "actorRole": "identity-auditor",
      "recordedAt": "2026-08-06T08:00:00+09:00",
      "previousDigest": "9eefae42025d4a6ed30af018a81b6f11c5b5bf09047800cea1b8754fc033f7a9",
      "eventDigest": "2ec98ea114f23c4804ddea21d314ae443a1708d3799d0aa754cc4c3da559683f"
    },
    {
      "sequence": 5,
      "field": "modelNumber",
      "status": "UNVERIFIED",
      "value": null,
      "reason": "No manufacturer model number is visible or supported by primary evidence.",
      "evidenceIds": [],
      "actorRole": "identity-auditor",
      "recordedAt": "2026-08-06T08:00:00+09:00",
      "previousDigest": "2ec98ea114f23c4804ddea21d314ae443a1708d3799d0aa754cc4c3da559683f",
      "eventDigest": "7de534005b913a80b8e3ab7cb80cf5ce84c2e8c24a8832d403309a991a013147"
    },
    {
      "sequence": 6,
      "field": "sellerSku",
      "status": "UNVERIFIED",
      "value": null,
      "reason": "No seller SKU is visible or supported by a verified listing.",
      "evidenceIds": [],
      "actorRole": "identity-auditor",
      "recordedAt": "2026-08-06T08:00:00+09:00",
      "previousDigest": "7de534005b913a80b8e3ab7cb80cf5ce84c2e8c24a8832d403309a991a013147",
      "eventDigest": "8927a04c6acabc8254b7662934d0ccaac4580b237f268345516fd6bc8afb9692"
    },
    {
      "sequence": 7,
      "field": "gtin",
      "status": "UNVERIFIED",
      "value": null,
      "reason": "No GTIN barcode or brand-owner assignment evidence is available; the identifier must not be inferred.",
      "evidenceIds": [],
      "actorRole": "identity-auditor",
      "recordedAt": "2026-08-06T08:00:00+09:00",
      "previousDigest": "8927a04c6acabc8254b7662934d0ccaac4580b237f268345516fd6bc8afb9692",
      "eventDigest": "653c0414640dfbbefbf183a9801de2c17bf1fdfc69d7f7fa1c6298cea3d8be10"
    },
    {
      "sequence": 8,
      "field": "jan",
      "status": "UNVERIFIED",
      "value": null,
      "reason": "No JAN barcode or brand-owner assignment evidence is available; the identifier must not be inferred.",
      "evidenceIds": [],
      "actorRole": "identity-auditor",
      "recordedAt": "2026-08-06T08:00:00+09:00",
      "previousDigest": "653c0414640dfbbefbf183a9801de2c17bf1fdfc69d7f7fa1c6298cea3d8be10",
      "eventDigest": "b0ebe0b98c4e60aa3252a2e08a3a0e74a31a6633a5759ca70e5aaaf38bef911b"
    },
    {
      "sequence": 9,
      "field": "colorCode",
      "status": "UNVERIFIED",
      "value": null,
      "reason": "The words winered and black describe visible colors but do not establish an official color code.",
      "evidenceIds": [],
      "actorRole": "identity-auditor",
      "recordedAt": "2026-08-06T08:00:00+09:00",
      "previousDigest": "b0ebe0b98c4e60aa3252a2e08a3a0e74a31a6633a5759ca70e5aaaf38bef911b",
      "eventDigest": "66d9e80cc2abbc8e8355e5b0597f20cdde177d190eb1f1981c78673cf8f00ab7"
    },
    {
      "sequence": 10,
      "field": "sizeCode",
      "status": "UNVERIFIED",
      "value": null,
      "reason": "No commercial size code is visible; Siroino _Large is the target avatar profile, not a product size code.",
      "evidenceIds": [],
      "actorRole": "identity-auditor",
      "recordedAt": "2026-08-06T08:00:00+09:00",
      "previousDigest": "66d9e80cc2abbc8e8355e5b0597f20cdde177d190eb1f1981c78673cf8f00ab7",
      "eventDigest": "5aa502aade7472f9cf20f8c527d2b0792f7998e2335be24e71bb8e0ba67667fb"
    },
    {
      "sequence": 11,
      "field": "season",
      "status": "UNVERIFIED",
      "value": null,
      "reason": "No collection season or sales period is supported by primary evidence.",
      "evidenceIds": [],
      "actorRole": "identity-auditor",
      "recordedAt": "2026-08-06T08:00:00+09:00",
      "previousDigest": "5aa502aade7472f9cf20f8c527d2b0792f7998e2335be24e71bb8e0ba67667fb",
      "eventDigest": "cf489d3aeca6720dc0096e1b5e83084d9099d8c718d52aac35557f2ae92b9a37"
    },
    {
      "sequence": 12,
      "field": "revision",
      "status": "UNVERIFIED",
      "value": null,
      "reason": "No manufacturer or seller revision identifier is supported by primary evidence.",
      "evidenceIds": [],
      "actorRole": "identity-auditor",
      "recordedAt": "2026-08-06T08:00:00+09:00",
      "previousDigest": "cf489d3aeca6720dc0096e1b5e83084d9099d8c718d52aac35557f2ae92b9a37",
      "eventDigest": "35bc47b35976788d306190e28da1eabfbb53ef3a62959e5d92fde7490cd80f8d"
    }
  ]
}
